id,text,label,label_name
1592,"According to Finnish Scanfil 's founder and chairman of the board , Jorma J. Takanen , the company has to look for growth abroad .",1,neutral
1593,"After non-recurring items of EUR 177mn , profit amounted to EUR 20mn .",1,neutral
1594,"Aldata Solution , a global company engaged in supplier to consumer business process optimization , has announced the details of its Dollars for Dinosaurs program .",1,neutral
1596,Almost two thirds of Olvi 's net sales come from outside Finland .,1,neutral
1597,Amanda Capital has investments in 22 private equity funds and in over 200 unquoted companies mainly in Europe .,1,neutral
1599,"As much biomass will be used as can be sourced locally , with the rest of the plant 's fuel needs met by peat .",1,neutral
1601,"Aspocomp Group , headquartered in Helsinki , Finland , develops interconnection solutions for the electronics industry .",1,neutral
1602,"Based in Helsinki , Finland , Ramirent has branches in 13 Nordic , central and Eastern European countries .",1,neutral
1603,"Based on the 2005 calendar year the combined company had EUR15 .8 bn in pro forma annual revenues and is expected to start operations with 60,000 employees .",1,neutral
1604,"BAVARIA Industriekapital AG 's 2006 revenues were EUR 333 million , with an EBITDA of EUR 51 million .",1,neutral
1607,"By the end of 2006 , the number of joint branch offices will total 170 .",1,neutral
1608,Cameco typically prices sales contracts using a 40:60 ratio of fixed prices and spot prices .,1,neutral
1609,Cargotec 's business areas also include the container handling solutions business area Kalmar and the marine cargo handling and offshore load handling solutions business area MacGREGOR .,1,neutral
1611,Cargotec will also move Hallberg-Ivarsson 's service and installation business under the same roof with its service center for Kalmar and MacGregor solutions in Gothenburg .,1,neutral
1615,"Componenta has production lines for similar-sized products at Karkkila in Finland , at Weert in the Netherlands and at Orhangazi in Turkey , and these had a combined output of approximately 100,000 tonnes and net sales of EUR 135 million in 2007 .",1,neutral
1616,CS Cabot 's main consumers on the Czech and Slovak market are tires producers Barum Continental and Matador Continental .,1,neutral
1617,Curators have divided their material into eight themes .,1,neutral
1619,"Currently , the company uses eight similar reach stackers and four empty container handlers by Konecranes .",1,neutral
1620,"Currently Glaston employs approximately 1,500 persons .",1,neutral
1621,"Currently it operates a fleet of eight carriers , as well as nine pushers and barges .",1,neutral
1623,"Customers wave cards in front of the reader to make payments , similar to `` touch and go '' cards used in transport systems .",1,neutral
1628,"EQ Bank forecasts Olvi 's net sales at EUR 67mn in the second quarter of 2009 , and operating profit at EUR 6.4 mn .",1,neutral
1630,EUR 152.4 mn of this was net interest income .,1,neutral
1632,Financing of the project will come mainly from China .,1,neutral
1634,"Fiskars is also engaged in the global supply of marine and energy equipment solutions and services through its associated company , Wartsila Corporation .",1,neutral
1636,"Following the demerger , the vice president of the group 's pharmaceutical trade in Finland , Jukka Niemi , will be appointed managing director of Oriola in addition to his current responsibilities .",1,neutral
1637,"For 2009 , net profit was EUR 3 million and the company paid a dividend of EUR 1.30 apiece .",1,neutral
1639,"From 2003 on , the emphasis of Kyro 's strategy has been on Glaston 's growth .",1,neutral
1640,Group net sales in the third quarter of 2007 totaled EUR 142.3 mn and operating profit EUR 4.3 mn .,1,neutral
1641,"He joins Technopolis from KONE where he has held various positions within the Group , most recently as Director of Service Business and Business Development for KONE s Middle Eastern operations .",1,neutral
1642,HK Ruokatalo 's target is to know the consumers .,1,neutral
1643,"In 2007 , Etteplan had turnover of EUR125 .2 m.",1,neutral
1644,"In 2007 , the Group 's net sales stood at EUR 42 million and it had about 1,445 employees .",1,neutral
1646,"In 2008 , AVC Systemhaus had net sales of EUR 10 million USD 7.1 m .",1,neutral
1647,In 2008 Stockmann earned 3.398 million lats in profit on 48.012 million lats in turnover .,1,neutral
1648,"In 2010 , Sanoma Magazines expects net sales to be at the 2009 level .",1,neutral
1649,"In addition , the company is considering the start of production in Russia .",1,neutral
1650,"In addition , the Kazakh delegation will visit Finland 's SITRA investment fund , Honkarakenne Ltd and Nokia headquarters to study TeliaSonera Ltd JSC 's activities .",1,neutral
1651,"In addition to its stake in MegaFon , Telecominvest currently owns 100 % of shares in Web Plus and St. Petersburg Payphones , 51 % in telecom equipment producer Peter-Servis and a number of other minor assets .",1,neutral
1652,"In addition to verification of an identity and digital signatures , new state-approved Mobile ID enables to cast votes in elections as well .",1,neutral
1653,"In April-June 2008 , Scanfil 's net sales totalled EUR 58.7 mn and operating profit EUR 6.6 mn .",1,neutral
1654,"In Finland , the five largest brands control 90 % of the beer market .",1,neutral
1658,"In the first quarter of 2008 , Sacanfil 's net sales totalled EUR 50.0 mn and its operating profit EUR 4.7 mn .",1,neutral
1659,"In the third quarter of 2007 , net sales totaled EUR 25.95 mn , and operating profit EUR 3.88 mn .",1,neutral
1660,"It comes complete with an LCD touch screen system for selection of your chosen function and prices start at around the pounds 4,805 mark .",1,neutral
1661,"It is being developed by Symbian , the software licensing consortium led by Nokia .",1,neutral
1662,It is estimated that the consolidated turnover of Kausta Guder will reach Lt 53mn US$ 22.53 mn EUR 15.35 mn in 2007 .,1,neutral
1663,"It now owns 80,565 shares in Amer Sports Corporation , equaling 0.11 % of the company 's share capital and voting rights .",1,neutral
1664,It posted a turnover of 4.5 mln euro $ 6.1 mln and an operating profit of 1.5 mln euro $ 2.0 mln for 2006 .,1,neutral
1665,Ixonos will finance the acquisition through a 3.8 mln euro $ 5.2 mln loan .,1,neutral
1666,Kauko-Telko 's centralized administration will be dissolved and appropriate parts of it will be transferred to operating activities and Group administration by the end of the year .,1,neutral
1667,"Kemira 's R&D organization comprises approximately 750 people , the company said .",1,neutral
1669,"LCS 's services cover the whole life cycle of software and information systems , from process modelling and tailored software development , to hosting services , solution management , maintenance and support .",1,neutral
1670,Lieksaare Oy has earlier been regarded under the control of Saarelainen Oy and the individual shareholders under the shareholder agreement .,1,neutral
1671,"Liquid handling products include electronic and mechanical pipettes , disposable tips as well as pipette maintenance and calibration services for research institutions , healthcare and industrial laboratories .",1,neutral
1673,Marathon estimates the value of its remaining stake in Protalix at $ 27 million .,1,neutral
1675,"Metsaliitto will sell 1.1 million B shares of Neomarkka , accounting for about 18.3 pct of Neomarkka 's equity and about 12.7 pct of the voting rights .",1,neutral
1676,"Most of the raw materials come from Europe and the US and are paid in euros or US dollars , while sales take place in rubles .",1,neutral
1677,"Motorola accounted for 11.5 percent of the South Korean handset market as of the end of April , Samsung held 55 percent and LG Electronics 19 percent , according to Korea-based ATLAS Research Group .",1,neutral
1678,"Motorola Inc. of the United States came second with shipments of 217.4 million units for a 21.3 percent market share , followed by South Korea 's Samsung Electronics Co. with shipments of 118.0 million units for an 11.6 percent share .",1,neutral
1679,Mr Jortikka is president of the base metal division of Outotec Oyj in Finland and is on the executive committee of Outotec .,1,neutral
1680,Mr K.R. Vasantha has been appointed Managing Director of Incap Contract Manufacturing Services Pvt. Ltd. .,1,neutral
1682,Mr. Koistinen joins from Nokia Siemens Networks where he has held various senior sales management and business development positions since 1997 .,1,neutral
1683,"Mr. McDonald started the evening with his own set , featuring hits from his solo career and his Doobie Brothers years and a selection of R&B cover songs that met with mixed results .",1,neutral
1684,No changes regarding the Virala Oy Ab s ownership of shares of Tiimari has taken place .,1,neutral
1685,No financial details of the deployment were disclosed .,1,neutral
1686,No financial or pricing details were disclosed .,1,neutral
1687,No planned closing date was provided .,1,neutral
1692,"Okmetic closed its plant in Espoo in early 2004 , and all production lines from the site were moved to Okmetic 's plants in Vantaa , Finland and Texas , USA .",1,neutral
1693,"On preliminary estimate , the hotel will operate under the brand Novotel .",1,neutral
1695,"Our customers include companies in the energy and process industry sectors , in particular .",1,neutral
1696,"Our key geographical markets are Europe , Russian Federation , Middle-East , South-Africa and Japan .",1,neutral
1697,"Outotec 's delivery covers the engineering , supply and construction of a circulating fluid bed calcination plant with a capacity of 1,600 tons of alumina per day .",1,neutral
1698,"Panostaja owns a 68.77 pct of share capital and the voting rights of Suomen Helasto shares following an exchange of shares which was carried out on May 30 , 2007 .",1,neutral
1699,"Payment for acquired shares will be made in cash , and the price per share will be EUR 1 plus an administration fee .",1,neutral
1700,Pharmaceutical market in Czech Republic Global Research & Data Services published recently a market analysis about the pharmaceutical markets in Czech Republic .,1,neutral
1701,Pharmaceutical market in Italy Global Research & Data Services published recently a market analysis about the pharmaceutical markets in Italy .,1,neutral
1702,"Previously , the company expected its 2008 financial performance to remain at the same level as in 2008 .",1,neutral
1705,"Quartal Oy now owns 2,094,063 shares in Satama Interactive Plc , which represents 5,19 per cent of the share capital and voting rights .",1,neutral
1706,Renesas Mobile Europe Ltd has approximately 470 employees in Oulu .,1,neutral
1709,RSA 's shares closed at 156.9 p at the time of going to press .,1,neutral
1712,"Since the registration of the shares subscribed in a directed share issue , the new number of Panostaja shares and voting rights is 41,733,110 .",1,neutral
1713,"Stora Enso 's business in North America has annual capacity of about 3 million tons and employs about 4,350 people .",1,neutral
1714,Stora Enso will receive a 19.9 pct equity interest in the combined company .,1,neutral
1716,Storengy is the GDF SUEZ company that is dedicated to the underground storage of natural gas .,1,neutral
1717,Tekla Group 's net sales for 2006 were approximately 50 million euros and operating result 13.6 million euros .,1,neutral
1720,"The acquired business main asset is a mobile authentication and signing solution , branded as Tectia MobileID , which provides authentication to web e-mail , SSL-VPN , MS SharePoint , Tectia Secure Solutions and other applications and resources .",1,neutral
1722,The agreement includes the entire process of managing Mercator 's supply chain in all regions where the company is currently present .,1,neutral
1723,The bank 's leasing arm Nordea Liising ended the year with a profit of 4.4 million euros .,1,neutral
1724,"The Board established a Remuneration Committee with following members : - Sari Baldauf Chairman - Tapio Hintikka - Heikki Westerlund In addition , the Board decided to appoint a Nomination Committee at a later stage .",1,neutral
1725,"The bond , with a maturity of five years , is part of the bank 's domestic bond program .",1,neutral
1726,The building will house product development and test laboratories .,1,neutral
1728,The business development initiatives in North America are headed by Lynn Shanahan .,1,neutral
1729,"The business is organised , as of February 1 , 2011 , in a way that production of design services is combined into one entity , Etteplan Operations .",1,neutral
1730,"The business transfer will take effect from 1 January 2007 , and in connection with this 47 employees will transfer from Elisa to Daxtum as continuing employees .",1,neutral
1731,The center will be built in the Kapuli district of Mantsala beside the Hanko-Mantsala-Porvoo road near the new direct rail link between Lahti and Jarvenpaa .,1,neutral
1732,The closing of such transaction took place today .,1,neutral
1733,"The closing of the transaction is scheduled to take place on January 10 , 2008 .",1,neutral
1734,The combined capital of these funds is expected to be EUR 100mn-150mn .,1,neutral
1735,The combined company had pro-forma net sales of 140 mln euro $ 188.9 mln and an operating profit of 13 mln euro $ 17.5 mln for 2006 .,1,neutral
1736,"The Committee proposes the following remuneration : a monthly remuneration of EUR 5,000 for the Chairman , EUR 3,500 for the Deputy Chairman , and EUR 2,500 for the other Board members .",1,neutral
1737,"The company , which has EUR2 .8 bn in assets , counts among its five largest shareholders Finnish insurers Ilmarinen 4.34 % and Varma 0.70 % , as well as the Finnish state pension fund VER 0.61 % .",1,neutral
1738,The company also equipped the sculptural complex Rabochy i Kolkhoznitsa A Worker and a Collective Farmer in Moscow with snow melting system .,1,neutral
1739,The company did not distribute a dividend in 2005 .,1,neutral
1740,"The company expects its net sales for the whole of 2007 to be EUR 950mn-1 ,000 mn .",1,neutral
1741,"The company had net sales of EUR 10.8 million in 2008 , and today has approximately 120 employees in Finland , Estonia and Poland .",1,neutral
1742,The company had net sales of EUR 19.8 mn and a pre-tax profit of EUR 1.8 mn in 2005 .,1,neutral
1745,"The company is involved in the the sale of financial products including insurance , mortgages , car and personal loans , financial brokerage and equipment finance leasing .",1,neutral
1746,"The Company operates through four principal divisions : Consumer Packaging ; Office Papers ; Speciality Papers , as well as Market Pulp and Energy .",1,neutral
1749,"The company 's transportation business is conducted through Florida Rock & Tank Lines , which is a Southeastern transportation company concentrating in the hauling by motor carrier of liquid and dry bulk commodities .",1,neutral
1751,"The company said that the operations will be sold to a newly established company , CPS GmbH , where the present management of the plastics business is a co-owner .",1,neutral
1752,"The composite body is coated with a hard coating layer produced by thermal spraying , and the coating is ground . ''",1,neutral
1753,"The connectivity unit has more than 100 e-invoice customers , and the number of annual transactions stands at nearly one million .",1,neutral
1756,The credit covers approximately 70 % of the ship 's price .,1,neutral
1758,"The customer is then forwarded to the site , and unknown to him logged in with the first number .",1,neutral
1759,"The deal includes all rental equipment and related merchandise , the rental contract of the depot and two employees , the company said .",1,neutral
1760,"The decision reflects the underutilisation of the line , which produces nonwovens used in medical and wipes applications as well as for the automotive industry .",1,neutral
1761,"The decision will have to be made whether the group agrees to the import of Estonian meat and meat products to Finland , the paper added .",1,neutral
1762,"The devices would be launched in the Chinese market in late 2006 , the company said .",1,neutral
1764,The divested activities had net sales of EUR 145.1 million in 2009 and an operating profit of EUR 8.9 million .,1,neutral
1765,"The divested company is part of TietoEnator 's business area Government , Manufacturing & Retail .",1,neutral
1767,The EA Reng group posted sales of approximately 84 million kroons for 2007 .,1,neutral
1769,"The EBRD is using its own funds to provide a 21.6 mln A loan while the B portion of 10 mln Euros has been syndicated to two Finnish commercial banks , Nordea Bank Finland Plc 7.7 mln Euros and Pohjola Bank Plc 2.3 mln Euros .",1,neutral
1771,The enterprise value of Maritim Food AS has been determined as approximately EUR15m .,1,neutral
1772,"The equipment Ixonos acquires with this deal includes mechanical engineering hardware ; an RF and antenna measurement laboratory ; facilities for the measurement of audio , cameras and displays ; as well as devices and robot units for the testing of mobile devices .",1,neutral
1773,"The equipment will be made at Vaahto 's plant in Hollola in Finland , and delivery is scheduled for the first quarter of 2009 .",1,neutral
1774,The estimated annual value of the frame agreement is about EUR 50mn .,1,neutral
1775,The estimated value of the deal is USD 9.2 million .,1,neutral
1778,The expanded company will continue to be called NewPage .,1,neutral
1779,The expanded plant is scheduled to be operational by the middle of October 2009 .,1,neutral
1780,The expansion is to be finalized in the autumn of 2009 .,1,neutral
1782,The figure does not include food exports from Finland .,1,neutral
1783,"The figure includes the change in the fair value of the property portfolio , EUR 26.2 million .",1,neutral
1784,"The Filter Tips cover the volume range from 0.1-1200 -Ál including new sizes for 10 , 20 , 100-120 , 200 , 300 , 1000 and 1200 -Ál volume capacities .",1,neutral
1785,The final outcome of the rights offering is to be reported around 23 October 2009 .,1,neutral
1787,"The group posted net sales of 35.3 mln euro $ 46.5 mln and an operating profit of 760,000 euro $ 1.0 mln in 2005 .",1,neutral
1788,The group 's net sales in 2007 were EUR683 .6 m.,1,neutral
1789,"The Group 's turnover in 2006 was EUR 39.2 million , and operating profit was EUR 3.9 million .",1,neutral
1791,"The manufacture of CPPs will be undertaken at the existing Export Oriented Unit EOU at Wartsila 's factory at Khopoli , near Mumbai .",1,neutral
1792,The markets expect Heineken to sell Hartwall as a whole or in parts .,1,neutral
1793,"The most significant capital expenditure items were in the global enterprise resource planning ERP project , product development and production machines .",1,neutral
1794,"The move will be carried out by transferring HKScan 's production-related property , plant , equipment , as well as its holdings in subsidiaries and associate companies in the country to HKScan Finland .",1,neutral
1796,The net sales of the Power Plants business were EUR 710.3 million in 2005 .,1,neutral
1797,The non-recurring costs caused to Talentum 's Premedia business area by the restructuring will amount to 2.0 mln euro $ 2.7 mln and will be included in the company 's financial results for the second quarter of 2007 .,1,neutral
1798,The ongoing project where Tekla Structures is being used is the Vashi Exhibition Centre being developed by Insteel Engineers Pvt Ltd-IIVRCL Infrastructures & Projects Ltd & CIDCO .,1,neutral
1799,"The operations to be sold include manufacturing units in Finland , France , Poland and Turkey , as well as sales units in Germany and Lithuania .",1,neutral
1802,The order includes 48 ship cranes that will be delivered for 12 container feeders to be built at Wenchong shipyard in China .,1,neutral
1806,The Oulu plant employs approximately 120 people .,1,neutral
1807,The percentages of shares and voting rights have been calculated in proportion to the total number of shares registered with the Trade Register and the total number of voting rights related to them .,1,neutral
1809,"The Polish business employs about 1,000 people , and it had net sales of about EUR 70mn in 2007 .",1,neutral
1813,"The remaining amount will be funded through debt , the Danish bank said .",1,neutral
1816,"The segments through which the company operates are Frozen Food business , Seafoods , Vegetable Oil business , Grain Trading and Other business operations .",1,neutral
1818,The solution will be installed in the USA to support the North American operations of the customer .,1,neutral
1819,"The Stockmann department store will have a total floor space of over 8,000 square metres and Stockmann 's investment in the project will have a price tag of about EUR 12 million .",1,neutral
1820,The studies are expected to start in 2008 .,1,neutral
1826,The total investment of the project will be approximately EUR 36m .,1,neutral
1827,The total value of the contract is some EUR 8 million .,1,neutral
1830,The transaction value is CAD 15 million approximately EUR 10 million .,1,neutral
1831,"The unit 's clients are mainly in the field of specialist convenience goods , as well as in the textile , shoe and furniture businesses .",1,neutral
1832,The value of the contract is about EUR 27mn .,1,neutral
1833,"The value of the contract is about EUR1 .0 m. Poyry , headquartered in Vantaa , Finland provides consulting and engineering services to the energy , forestry and infrastructure & environment sectors .",1,neutral
1834,The value of the contract is EUR 25mn .,1,neutral
1835,The value of the contract is in total USD12m .,1,neutral
1836,The value of the contracts is about EUR 3.3 mn .,1,neutral
1837,The value of the deal has not been disclosed .,1,neutral
1838,The value of the deal was not disclosed .,1,neutral
1839,The value of the multi-year agreement is over EUR 2mn a year .,1,neutral
1840,The value of the three-year contract is estimated at EUR40m .,1,neutral
1841,The value of this kind of order amounts usually between Euro 2 and 3 million .,1,neutral
1843,"The works will include the laying of natural stone pavements and the installation of underground heating , and surface water drainage systems .",1,neutral
1844,There have not been previous share subscriptions with 2004 stock options .,1,neutral
1846,"This could be any of us at any time , '' she said .",1,neutral
1847,This wood lacquered clock comes with a stripy hand-crocheted cover .,1,neutral
1849,Total value of the contract is about EUR 10mn .,1,neutral
1850,"Tulikivi manufactures heat-retaining , soapstone and ceramic fireplaces , as well as natural stone products and utility ceramics .",1,neutral
1851,"Tyrv+ñinen is of the opinion that the airline has been repeating this for some time already , however .",1,neutral
1852,"Under the agreement , Larox will transfer 10 employees within engineering and documentation related to delivery projects and product maintenance in Finland to Etteplan as of January 1 , 2007 .",1,neutral
1853,"Under the transaction agreement , Metsaliitto will purchase 24.7 % of Metsa-Botnia 's shares from UPM and 3 % from M-real .",1,neutral
1856,Valmet Automotive reports net sales of EUR 85mn and operating profit of EUR 8mn .,1,neutral
1860,"With the new arrangement , customer responsibilities will become mainly regional .",1,neutral
1862,"In the third quarter of fiscal 2008 Efore swung to a net loss of EUR 400,000 versus a net profit of EUR 200,000 for the corresponding period of fiscal 2007 .",0,negative
1865,"Production levels have been agreed with producers a long time ago , so a fall in consumption will lead to losses .",0,negative
1869,"Finnish shipping company Finnlines ' pretax loss totalled EUR 6.5 mn in the third quarter of 2009 , compared to a profit of EUR 0.3 mn in the third quarter of 2008 .",0,negative
1870,"In Finland , the city of Forssa has said it will not pay compensation to food industry companies HK Ruokatalo and Atria for the lye leak into tap water that occurred in March 2008 .",0,negative
1873,Diluted earnings per share ( EPS ) stood at EUR 0.25 versus EUR 0.42 .,0,negative
1875,Finnish communication electronics components supplier Scanfil Oyj Tuesday said sales in the first half of 2006 will be 15 % lower than during the same period a year ago .,0,negative
1877,"In Q1 of 2009 , the company 's operating loss totalled EUR 0.3 mn , compared to a profit of EUR 3.6 mn in Q1 of 2008 .",0,negative
1880,Loss for the period totalled EUR 15.6 mn compared to a profit of EUR 6.3 mn in 2008 .,0,negative
1881,Operating loss amounted to EUR 0.9 mn in the first half of 2006 compared to a profit of EUR 0.5 mn in the first half of 2005 .,0,negative
1882,"Operating loss of the Pulp & Paper Machinery unit was over EUR 3mn in September 2007 - August 2008 , compared to a profit of EUR 3.7 mn a year earlier .",0,negative
1883,Operating loss totaled EUR 0.3 mn compared to a profit of EUR 2.2 mn in the corresponding period in 2007 .,0,negative
1884,"Operating loss totaled EUR 0.8 mn , compared to a profit of EUR 0.5 mn .",0,negative
1888,Pretax loss totaled EUR 117mn compared to a loss of EUR 65mn in the corresponding period .,0,negative
1889,Pretax loss totalled EUR 162.3 mn compared to a profit of EUR 253.5 mn in 2007 .,0,negative
1891,"Publishing Sweden 's operating loss was EUR 1.1 mn in Q1 of 2009 , compared to a profit of EUR 0.6 mn a year ago .",0,negative
1893,"Cerberus Capital Management LP-backed printing paper maker NewPage Corp. has posted mixed second-quarter results , casting a cloud over its planned initial public offering .",0,negative
