id,text,label,label_name
0,"According to Gran , the company has no plans to move all production to Russia , although that is where the company is growing .",1,neutral
1,"For the last quarter of 2010 , Componenta 's net sales doubled to EUR131m from EUR76m for the same period a year earlier , while it moved to a zero pre-tax profit from a pre-tax loss of EUR7m .",2,positive
2,"In the third quarter of 2010 , net sales increased by 5.2 % to EUR 205.5 mn , and operating profit by 34.9 % to EUR 23.5 mn .",2,positive
5,"Finnish Talentum reports its operating profit increased to EUR 20.5 mn in 2005 from EUR 9.3 mn in 2004 , and net sales totaled EUR 103.3 mn , up from EUR 96.4 mn .",2,positive
6,"Clothing retail chain Sepp+ñl+ñ 's sales increased by 8 % to EUR 155.2 mn , and operating profit rose to EUR 31.1 mn from EUR 17.1 mn in 2004 .",2,positive
7,"Consolidated net sales increased 16 % to reach EUR74 .8 m , while operating profit amounted to EUR0 .9 m compared to a loss of EUR0 .7 m in the prior year period .",2,positive
9,"HELSINKI ( AFX ) - Shares closed higher , led by Nokia after it announced plans to team up with Sanyo to manufacture 3G handsets , and by Nokian Tyres after its fourth-quarter earnings report beat analysts ' expectations , dealers said .",2,positive
12,"Net income from life insurance doubled to EUR 6.8 mn from EUR 3.2 mn , and net income from non-life insurance rose to EUR 5.2 mn from EUR 1.5 mn in the corresponding period in 2009 .",2,positive
13,Net sales increased to EUR193 .3 m from EUR179 .9 m and pretax profit rose by 34.2 % to EUR43 .1 m. ( EUR1 = USD1 .4 ),2,positive
14,"Net sales surged by 18.5 % to EUR167 .8 m. Teleste said that EUR20 .4 m , or 12.2 % , of the sales came from the acquisitions made in 2009 .",2,positive
15,Nordea Group 's operating profit increased in 2010 by 18 percent year-on-year to 3.64 billion euros and total revenue by 3 percent to 9.33 billion euros .,2,positive
16,"Operating profit for the nine-month period increased from EUR13 .6 m , while net sales increased from EUR394 .7 m , as compared to the corresponding period in 2005 .",2,positive
17,"Operating profit for the three-month period increased from EUR1 .2 m , while revenue increased from EUR20 .2 m , as compared to the corresponding period in 2005 .",2,positive
18,"The company 's net profit rose 11.4 % on the year to 82.2 million euros in 2005 on sales of 686.5 million euros , 13.8 % up on the year , the company said earlier .",2,positive
19,"The Lithuanian beer market made up 14.41 million liters in January , a rise of 0.8 percent from the year-earlier figure , the Lithuanian Brewers ' Association reporting citing the results from its members .",2,positive
20,"Viking Line 's cargo revenue increased by 5.4 % to EUR 21.46 mn , and cargo volume increased by 2.4 % to 70,116 cargo units .",2,positive
22,10 February 2011 - Finnish media company Sanoma Oyj HEL : SAA1V said yesterday its 2010 net profit almost tripled to EUR297 .3 m from EUR107 .1 m for 2009 and announced a proposal for a raised payout .,2,positive
23,"A Helsinki : ELIiV today reported EPS of EUR1 .13 for 2009 , an increase over EPS of EUR1 .12 in 2008 .",2,positive
24,"Commission income increased by 22 % to EUR 4.4 mn , and lending volume rose by 13.5 % .",2,positive
26,"In January-September 2010 , Fiskars ' net profit went up by 14 % year-on-year to EUR 65.4 million and net sales to EUR 525.3 million from EUR 487.7 million .",2,positive
27,"Net income from life insurance rose to EUR 16.5 mn from EUR 14.0 mn , and net income from non-life insurance to EUR 22.6 mn from EUR 15.2 mn in 2009 .",2,positive
28,Sales have risen in other export markets .,2,positive
29,Sales increased due to growing market rates and increased operations .,2,positive
30,The agreement strengthens our long-term partnership with Nokia Siemens Networks .,2,positive
32,"The company said that paper demand increased in all of its main markets , including of publication papers , and that it increased average paper prices by 4 percent compared with last year .",2,positive
33,"The world 's second largest stainless steel maker said net profit in the three-month period until Dec. 31 surged to euro603 million US$ 781 million , or euro3 .33 US$ 4.31 per share , from euro172 million , or euro0 .94 per share , the previous year .",2,positive
34,"Shares of Standard Chartered ( STAN ) rose 1.2 % in the FTSE 100 , while Royal Bank of Scotland ( RBS ) shares rose 2 % and Barclays shares ( BARC ) ( BCS ) were up 1.7 % .",2,positive
36,"In its financial report , published on Friday , SEB said its net profit soared to SEK6 .745 bn in 2010 from a year-earlier SEK1 .114 bn and proposed a 50 % dividend increase to SEK1 .50 per share .",2,positive
38,STOCK EXCHANGE ANNOUNCEMENT 20 July 2006 1 ( 1 ) BASWARE SHARE SUBSCRIPTIONS WITH WARRANTS AND INCREASE IN SHARE CAPITAL A total of 119 850 shares have been subscribed with BasWare Warrant Program .,1,neutral
40,Tiimari operates 194 stores in six countries -- including its core Finnish market -- and generated a turnover of 76.5 mln eur in 2005 .,1,neutral
41,The acquisition will considerably increase Kemira 's sales and market position in the Russian metal industry coatings market .,2,positive
43,"Adjusted for changes in the Group structure , the Division 's net sales increased by 1.7 % .",2,positive
45,Finnish Aktia Group 's operating profit rose to EUR 17.5 mn in the first quarter of 2010 from EUR 8.2 mn in the first quarter of 2009 .,2,positive
50,Biohit already services many current Genesis customers and the customer base is expected to expand as a result of this agreement .,2,positive
51,"Both operating profit and turnover for the three-month period increased , respectively from EUR0 .9 m and EUR8 .3 m , as compared to the corresponding period in 2005 .",2,positive
53,Clothing chain Sepp+ñl+ñ 's net sales increased by 7.0 % to EUR 30.8 mn .,2,positive
54,Construction volumes meanwhile grow at a rate of 10-15 percent annually .,2,positive
55,"However , Biohit estimates its total net sales will continue to grow in 2009 , and that favourable trends in net sales will lead to a profit in 2009 .",2,positive
56,"In 2009 , Fiskars ' cash flow from operating activities amounted to EUR121m , up from EUR97m in the previous year .",2,positive
58,"In the fourth quarter of 2008 , net sales increased by 2 % to EUR 1,050.7 mn from EUR 1,027.0 mn in the fourth quarter of 2007 .",2,positive
60,Net sales grew in the period to  x20ac 402 million $ 585US million from  x20ac 401 million in 2006 .,2,positive
61,Net sales increased to EUR655m in April to June 2010 from EUR438m a year earlier .,2,positive
62,"Net sales rose by 25.5 % year-on-year to EUR59 .6 m , as the number of chargers delivered went up by 41 % to 65.9 million pieces .",2,positive
63,"Net sales totaled EUR 93.6 mn , up from EUR 93.2 mn in the corresponding period in 2005 .",2,positive
65,Operating profit margin increased from 11.2 % to 11.7 % .,2,positive
66,Operating profit rose to EUR 3.11 mn from EUR 1.22 mn in the corresponding period in 2009 .,2,positive
69,"Ramirent 's net sales in the second quarterended June 30 were EURO 128.7 million about U.S. $ 163 million , a 3.3-percent increase compared with EURO 124.6 million for thesecond quarter last year .",2,positive
70,"Revenue grew by 2 percent to  x20ac 580 million $ 743 million , from  x20ac 569 million .",2,positive
71,"Ruukki 's delivery volumes and selling prices showed favourable development and the company 's comparable net sales grew by 50 % year-on-year to EUR647m , CEO Sakari Tamminen said .",2,positive
73,The Department Store Division reported an increase in sales of 4 per cent .,2,positive
74,The fair value of the company 's investment properties grew to EUR 2.803 billion at the end of March 2009 from EUR 2.691 million a year ago .,2,positive
75,"The last quarter was the best quarter of 2009 in net sales , and the operating margin rose to 12.2 % .",2,positive
76,"The major breweries increased their domestic beer sales by 4.5 per cent last year , to 256.88 million litres from 245.92 million litres in 2004 .",2,positive
78,21 October 2010 - Finnish fishing tackle company Rapala VMC Corp ( HEL : RAP1V ) said today its net profit rose to EUR18 .9 m for the first nine months of 2010 from EUR15 .1 m for the same period a year earlier .,2,positive
81,Finnish financial group Aktia 's operating profit for 2009 increased to EUR 47.0 mn from EUR 6.6 mn in 2008 .,2,positive
82,Finnish forest machinery manufacturer Ponsse 's net sales grew to EUR 51.3 mn in the first quarter of 2010 from EUR 37.5 mn in the corresponding period in 2009 .,2,positive
83,Finnish KCI Konecranes has raised its net sales growth estimate for 2006 from over 25 % to over 35 % .,2,positive
84,"According to HKScan Finland , the plan is to increase J+ñrvi-Suomen Portti 's net sales to EUR 80mn to EUR 100mn .",2,positive
85,"Advertising and circulation revenues grew by 3.4 % and by 0.4 % , respectively .",2,positive
86,"At the end of March 2007 , the group 's order book was at EUR 39.6 mn , up 42 % from the corresponding period in 2006 .",2,positive
87,"At the same time profit of the company increased by 10 % in H1 and reached Ls 79,000 .",2,positive
88,"Both operating profit and net sales for the 12-month period increased , respectively from EUR10 .5 m and EUR28 .8 m , as compared to the financial year 2004 .",2,positive
89,"Both operating profit and net sales for the 12-month period increased , respectively from EUR20 .8 m and EUR177 .7 m , as compared to the financial year 2004 .",2,positive
90,"Both operating profit and net sales for the 12-month period increased , respectively from EUR21 .5 m and EUR196 .1 m , as compared to 2005 .",2,positive
92,"Both operating profit and net sales for the nine-month period increased , respectively by 26.6 % and 3.4 % , as compared to the corresponding period in 2006 .",2,positive
93,"Both operating profit and net sales for the six-month period increased , respectively , from EUR13 .8 m and EUR143 .6 m , as compared to the corresponding period in 2007 .",2,positive
96,"Both operating profit and net sales for the six-month period increased , respectively from EUR7 .5 m and EUR655 .5 m , as compared to the corresponding period in 2005 .",2,positive
97,"Both operating profit and net sales for the three-month period increased , respectively from EUR15 .1 m and EUR131 .5 m , as compared to the corresponding period in 2005 .",2,positive
98,"Both operating profit and net sales for the three-month period increased , respectively from EUR16 .0 m and EUR139m , as compared to the corresponding quarter in 2006 .",2,positive
99,"Both operating profit and sales for the three-month period increased , respectively from EUR0 .3 m and EUR13 .1 m , as compared to the corresponding period in 2005 .",2,positive
101,"Both operating profit and turnover for the six-month period increased , respectively , from EUR17 .6 m and EUR1149 .9 m , as compared to the corresponding period in 2007 .",2,positive
104,"comparable operating profit totaled EUR 854mn , up from EUR 730mn in 2004 .",2,positive
105,"Digia said its consolidated net sales for January-June 2010 were EUR67 .8 m , up 9.7 % on the same period in 2009 ( EUR61 .9 m ) .",2,positive
106,Diluted earnings per share ( EPS ) rose to EUR 0.29 from EUR 0.05 .,2,positive
107,Diluted earnings per share ( EPS ) rose to EUR 0.52 versus EUR 0.09 .,2,positive
108,Diluted earnings per share ( EPS ) rose to EUR 1.05 from EUR 0.64 .,2,positive
111,EBIT margin was up from 1.4 % to 5.1 % .,2,positive
112,"EPS from continuing operations came in at 0.30 eur , up from 0.17 .",2,positive
114,"EUR928 ,000 in Q1 2010 6 May 2010 - Finnish textile and clothing design company Marimekko Oyj ( HEL : MMO1V ) said today its net profit rose to EUR928 ,000 in the first quarter of 2010 from EUR13 ,000 in the corresponding period a year earlier .",2,positive
115,"Finland-based Elcoteq SE , a privately held provider of electronics manufacturing services to communications companies , said Thursday it signed a long-term manufacturing supply deal with communications equipment company Andrew Corp. .",2,positive
117,Finnish department store chain Stockmann Oyj Abp net profit rose to 39.8 mln euro ( $ 56.8 mln ) for the first nine months of 2007 from 37.4 mln euro ( $ 53.4 mln ) for the same period of 2006 .,2,positive
120,Finnish metal products company Componenta Oyj net profit rose to 26.1 mln euro ( $ 35.9 mln ) for the first quarter of 2007 from 5.3 mln euro ( $ 7.3 mln ) for the same period of 2006 .,2,positive
122,"Finnish security and privacy software solutions developer Stonesoft Oyj said on January 7 , 2008 that the preliminary sales of its StoneGate products grew by 59 pct year-on-year to 3.6 mln euro ( $ 5.3 mln ) for the fourth quarter of 2007 .",2,positive
124,Finnish software developer Done Solutions Oyj said its net profit increased to 3.5 mln euro ( $ 4.6 mln ) in 2006 from 2.3 mln euro ( $ 3.0 mln ) in 2005 .,2,positive
125,First quarter underlying operating profit rose to 41 mln eur from 33 mln a year earlier .,2,positive
126,"For the first nine months of 2010 , the company 's net profit rose to EUR41m from EUR30m for the corresponding period of 2009 .",2,positive
127,"HELSINKI ( AFX ) - Retail and wholesale group Kesko reported net sales of 659.4 mln eur for February , an increase of 10.8 pct year-on-year .",2,positive
129,"However , sales returned to growth in April-June 2010 , CEO Pekka Eloholma said .",2,positive
131,"Svyturys-Utenos Alus , which is controlled by the Nordic group Baltic Beverages Holding ( BBH ) , posted a 4.7-per-cent growth in beer sales for January-May to 46.22 million litres .",2,positive
132,"In December alone , the members of the Lithuanian Brewers ' Association sold a total of 20.3 million liters of beer , an increase of 1.9 percent from the sales of 19.92 million liters in December 2004 .",2,positive
133,"In January-September 2009 , the Group 's net interest income increased to EUR 112.4 mn from EUR 74.3 mn in January-September 2008 .",2,positive
135,"In Sweden , operating profit for the period under review totaled EUR 3.4 mn , up 30.8 % from the corresponding period in 2005 .",2,positive
136,"In the fourth quarter of 2009 , Orion 's net profit went up by 33.8 % year-on-year to EUR33m .",2,positive
137,"In the second quarter of 2010 , the group 's net profit rose to EUR 3.1 million from EUR 2.5 million in April-June 2009 .",2,positive
139,"In the third quarter , net sales increased by 12 % year-on-year to EUR 159.5 million , or by 6 % at comparable currency rates growth .",2,positive
140,"In the third quarter , net sales increased by 12 % year-on-year to EUR159 .5 m , or by 6 % at comparable currency rates growth .",2,positive
142,"Kesko Agro Eesti , the retailer and wholesaler of grain , agricultural and warehousing machinery and accessories , had net sales of 81 million euros in 2007 , an increase by one-tenth over the preceding year .",2,positive
143,"Kesko 's car import and retailing business , VV-Auto , saw sales grow by 17.1 pct .",2,positive
145,"( ADP News ) - Feb 11 , 2009 - Finnish management software solutions provider Ixonos Oyj ( HEL : XNS1V ) said today its net profit rose to EUR 3.5 million ( USD 4.5 m ) for 2008 from EUR 3.1 million for 2007 .",2,positive
146,"( ADP News ) - Feb 12 , 2009 - Finnish IT solutions provider Affecto Oyj ( HEL : AFE1V ) said today its net profit rose to EUR 8.5 million ( USD 11m ) in 2008 from EUR 7 million in 2007 .",2,positive
147,"( ADP News ) - Feb 6 , 2009 - Finnish fishing tackle company Rapala VMC Corp ( HEL : RAP1V ) said today its net profit rose to EUR 19.2 million ( USD 24.6 m ) for 2008 from EUR 17.5 million for 2007 .",2,positive
151,Net interest income increased by 4.5 % to EUR 31.4 mn from EUR 30.0 mn in 2004 .,2,positive
152,"Net interest income was EUR 152.2 mn , up from EUR 101.0 mn in 2008 .",2,positive
154,Net sales of the Vegetable Oil Business rose to EUR 10.6 mn from EUR 10.1 mn .,2,positive
155,"Nokia Multimedia 's net sales totaled EUR 5.7 bn , up 45 % from the corresponding period in 2005 .",2,positive
157,"Operating profit of Kauppalehti group rose to EUR 1.5 mn from EUR 1.3 mn , and that of Marketplaces to EUR 1.3 mn from EUR 1.0 mn in the third quarter of 2006 .",2,positive
158,Operating profit rose from EUR 1.94 mn to EUR 2.45 mn .,2,positive
159,Operating profit rose to 22.1 mln eur from 19.9 mln .,2,positive
160,Operating profit rose to EUR 1.6 mn from EUR 1.1 mn in the corresponding period in 2006 .,2,positive
161,Operating profit rose to EUR 103.4 mn from EUR 23.2 in the corresponding period in 2006 .,2,positive
163,Operating profit rose to EUR 26.7 mn from EUR 14.9 mn in the corresponding period in 2006 .,2,positive
164,Operating profit rose to EUR 27.8 mn from EUR 17.5 mn in 2008 .,2,positive
165,Operating profit rose to EUR 3.2 mn from EUR 1.0 mn in the corresponding period in 2008 .,2,positive
166,Operating profit rose to EUR 4.7 mn from EUR 3.6 mn .,2,positive
168,Operating profit rose to EUR 9.2 mn from EUR 6.8 mn in the corresponding period in 2007 .,2,positive
169,Operating profit rose to EUR2 .4 m from EUR1 .6 m year earlier .,2,positive
170,"Operating profit surged to EUR21m from EUR106 ,000 .",2,positive
171,"Operating profit totaled EUR 37,7 mn , up slightly from EUR 37.2 mn in the corresponding period in 2006 .",2,positive
172,"Operating profit totaled EUR 5.5 mn , up from EUR -0.7 mn .",2,positive
174,"Operating profit was EUR 139.7 mn , up 23 % from EUR 113.8 mn .",2,positive
176,Orders received grew by 55 % year-on-year to EUR732m .,2,positive
177,Orion Pharma 's operating profit increased by 42.5 % from 2004 .,2,positive
178,Passenger volumes rose by 8.4 % in the accounting period .,2,positive
179,Passenger-related revenue rose by 5.1 % to EUR 460.8 mn from EUR 438.5 mn in 2009 .,2,positive
180,Pretax profit rose to EUR 0.6 mn from EUR 0.4 mn in the corresponding period in 2005 .,2,positive
181,"Pretax profit rose to EUR 1,019 mn from EUR 1,007 in the corresponding period in 2005 .",2,positive
182,Pretax profit rose to EUR 17.8 mn from EUR 14.9 mn in 2005 .,2,positive
183,"Pre-tax profit totaled EUR 397.4 mn , up from EUR 164.7 mn .",2,positive
184,"Profit for the period totaled EUR 39.4 mn , up from EUR 33.9 mn in the corresponding period in 2006 .",2,positive
185,"Profit for the period was EUR 5.9 mn , up from EUR 1.3 mn .",2,positive
187,Revenue grew 12 percent to (  x20ac ) 3.6 billion ( US$ 4.5 billion ) .,2,positive
188,"Revenue in July to September grew 14 percent to ( EURO ) 467 million from a year earlier , the company said Thursday .",2,positive
189,Revenues at the same time grew 14 percent to 43 million euros .,2,positive
190,"Sales in Latin America increased by 42 % to EUR 432mn , and a total of 8.7 mn mobile devices were sold in the area , representing an increase of 32 % from the corresponding period in 2009 .",2,positive
191,Sanoma Magazines Finland 's net sales grew to EUR 140.1 mn from EUR 131.8 mn .,2,positive
192,"Satama 's net profit for the third quarter of 2007 rose to 275,000 euro ( $ 395,000 ) from 270,000 euro ( $ 388,000 ) for the same period of 2006 .",2,positive
193,"Section : Regional News - The demand in Finnair 's Asian traffic , measured in passenger kilometers , was up 34.9 % in August compare to last year .",2,positive
194,"Svyturys-Utenos Alus , which is controlled by the Nordic group Baltic Beverages Holding ( BBH ) , posted a 6.1 percent growth in beer sales for January-September to 101.99 million liters .",2,positive
195,That would be an increase from estimated sales of 117 million last year .,2,positive
196,"The chain posted sales of 298 million euros for full 2005 , a rise of 19.5 percent , year-on-year .",2,positive
197,The company expects its net sales in 2008 to increase 5-10 % from 2007 .,2,positive
198,"The company 's operating income ( EBIT ) totalled EUR 0.0 mn , up from EUR -0.3 mn year-on-year .",2,positive
199,The EPS outlook was increased by 5.6 pct for 2007 and 7.0 pct for 2008 .,2,positive
203,The operating profit for Grain Trading increased to EUR 2.0 mn from EUR 1.4 mn in 2005 .,2,positive
205,The stock rose for a third day on Tuesday bringing its three-day rise to GBX10 .50 or 1.8 % .,2,positive
207,Total operating revenue grew by 27.6 % year-on-year to EUR61m .,2,positive
208,Vacon 's cash flow from operations grew to EUR 37.1 mn from EUR 21.9 mn a year ago .,2,positive
209,"`` BasWare 's product sales grew strongly in the financial period , by 24 percent .",2,positive
211,Affecto expects its net sales for the whole 2010 to increase from the 2009 level when they reached EUR 103 million .,2,positive
212,Cash flow from operations rose to EUR 52.7 mn from EUR 15.6 mn in 2007 .,2,positive
213,Commission income rose by 25.7 % to EUR 16.1 mn from EUR 12.8 mn in 2004 .,2,positive
214,"Earnings per share for January-June 2010 were EUR0 .30 , an increase of 20 % year-on-year EUR0 .25 .",2,positive
216,"Elisa said mobile subscriptions grew 7 percent during 2007 , mainly because of customers adopting so-called third generation mobile technology .",2,positive
218,EPS grew to 0.04 eur from 0.02 eur .,2,positive
220,"Finnish investment group Panostaja Oyj said its net profit went up to 8.6 mln euro $ 11.4 mln in fiscal 2005-06 , ended October 31 , 2006 , from 2.8 mln euro $ 3.7 mln in the same period of fiscal 2004-05 .",2,positive
221,Finnish metal components supplier Componenta Oyj said its net profit went up to 3.5 mln euro $ 4.5 mln in 2006 from 2.2 mln euro $ 2.8 mln in 2005 .,2,positive
223,"Fiskars Brands report net sales of EUR 145.8 mn , up from EUR 138.4 mn .",2,positive
225,"In January-September 2007 , the group 's net sales from continuing operations rose to EUR 213.1 mn from EUR 172.6 mn in the corresponding period in 2006 .",2,positive
227,"In the reporting period , net sales rose by 8 % year-on-year to EUR64 .3 m , due to the business acquisitions realized during the first half of 2008-09 , the effect of which was EUR10 .9 m in the review period .",2,positive
229,Last year 's net sales rose to EUR 68.3 million from EUR 62.2 million .,2,positive
230,"Last year the company raised its turnover to approximately 7 million litas EUR 2 mln , from 6.1 million litas in 2004 .",2,positive
231,Marimekko Group 's full-year net sales are estimated to increase by about 10 % .,2,positive
233,"Nevertheless , its market share rose to 49.14 percent from 48.51 percent a year earlier .",2,positive
235,"Olvi , which controls a 94 percent stake in Ragutis through A. Le Coq , said in its annual report published earlier this year that the Lithuanian brewery 's sales reached 15.04 million euros last year , a rise of 20.4 percent from 12.49 million euros in 2004 .",2,positive
236,Olvi expects sales and market share to increase in the first quarter of 2010 .,2,positive
238,Operating profit of the Asian plants grew markedly .,2,positive
239,"Operating profit totaled EUR 825mn , up from EUR 763mn in 2004 .",2,positive
240,"Operating profit totalled EUR 83.0 mn , up from EUR 23.5 mn year-on-year .",2,positive
242,Profit for the period increased from EUR 2.9 mn to EUR 10.5 mn .,2,positive
244,Return on capital employed rose by 4.8 percentage points to 19.6 % .,2,positive
245,"Revenue from July to September grew 21 percent to EURO 2.3 billion , the Finnish company said Thursday .",2,positive
247,Ruukki 's order book at the end of 2010 was 30 % up year-on-year and 10 % up quarter-on-quarter .,2,positive
249,Sales of security and system packaging increased slightly .,2,positive
250,Stora Enso 's third-quarter pre-tax profit doubled to EUR 197mn .,2,positive
251,The company 's market share is continued to increase further .,2,positive
252,"The company 's scheduled traffic , measured in revenue passenger kilometres RPK , grew by just over 2 % and nearly 3 % more passengers were carried on scheduled flights than in February 2009 .",2,positive
254,"The earnings per share for the quarter came in at 0.25 eur , up from the 0.20 eur of the same quarter a year earlier .",2,positive
255,The economic occupancy rate of Sponda 's property portfolio rose to 91.2 % from 88.8 % in 2006 .,2,positive
257,The growth of net sales in the first half of 2008 has been 28 % compared with the first half of 2007 .,2,positive
258,The pretax profit of the group 's life insurance business increased to EUR 36 million from EUR 27 million .,2,positive
259,The pretax profit of the group 's life insurance business increased to EUR36m from EUR27m .,2,positive
262,Turnover rose to EUR21m from EUR17m .,2,positive
263,Finnish Talvivaara Mining Co HEL : TLV1V said Thursday it had picked BofA Merrill Lynch and JPMorgan NYSE : JPM as joint bookrunners of its planned issue of convertible notes worth up to EUR250m USD332m .,1,neutral
265,Vacon controls a further 5 % of the company via investment fund Power Fund I. EUR 1.0 = USD 1.397,1,neutral
266,4 ) Complete name of the shareholder : Otto Henrik Bernhard Nyberg 5 ) Further information : The amount of shares now transferred corresponds to 5.68 % of the total number of shares in Aspo Plc. .,1,neutral
267,"A data processing unit collects the data , calculates RVR values and provides the data to users via various interfaces .",1,neutral
268,"German Commerzbank AG 's Hamburg Branch and US JP Morgan ( NYSE : JPM ) participated as arrangers , and Dutch ING ( AMS : INGA ) as co-arranger .",1,neutral
269,Increase in the number of shares is based on the option rights which were granted to the management of the company under the stock option plan 2006 .,1,neutral
270,It has some 30 offices worldwide and more than 90 pct of its net sales are generated outside Finland .,1,neutral
271,It has80 branches in Finland with annual revenue in Finland of ?,1,neutral
