id,text,label,label_name
506,"Mr. Mikko Saavalainen , head of Comptel 's Global Sales concludes : `` Gibtelecom provides a perfect illustration of the variety of business , technical and regulatory challenges operators are facing in their OSS today .",1,neutral
507,"Professional and consumer applications include personal navigation , personal safety , field and workflow management , and asset tracking .",1,neutral
508,Satama and Trainers ' House will remain as names and independent brands of the business areas .,1,neutral
509,"The above mentioned shareholders will suggest that a monthly salary of EUR 1,400 would be paid for the Board members outside the company .",1,neutral
510,"The address location is provided to a local controller , preferably by wireless transmission , which then uses the address location to access the appliance control module .",1,neutral
511,The Bank is also examining the benefits of transferring the Swedish business to operate as a branch office so that the operations would be governed by Finland 's laws .,1,neutral
512,"The donations are granted to Aalto University and the universities of Helsinki , Tampere , Turku , Eastern Finland , Jyv+ñskyl+ñ , Oulu and Vaasa , and to polytechnics to be announced later .",1,neutral
513,"The guidance has been set at 90 basis points over mid-swaps , the report said .",1,neutral
514,The invention carries International Patent Publication No. .,1,neutral
515,"The inventors are Bylander Johan , Ponten Fredrik and Lundberg Jorgen .",1,neutral
516,"The inventors are Mukkavilli Krishna Kiran , Sabharwal Ashutosh and Aazhang Behnaam .",1,neutral
517,"The Inventors are Ridge Justin , Bao Yiliang and Karczewicz Marta .",1,neutral
519,The issuer is solely responsible for the content of this announcement .,1,neutral
520,"The market making in accordance with the agreement will begin on September 24 , 2009 .",1,neutral
524,"The total investment in the Vantaa plant extension will amount to around 10 million euro , and Okmetic 's share of the investments will be worth around 2.7 million .",1,neutral
525,Welcome !,1,neutral
526,"You need to be ready when the window opens up , Rosberg said .",1,neutral
528,`` The issues identified by Stonesoft affect a range of content inspection technology .,1,neutral
529,`` They want my credit card info and my personal details .,1,neutral
530,About Dopplr Dopplr is a service for smart travellers .,1,neutral
533,"According to Finnair Technical Services , the measure is above all due to the employment situation .",1,neutral
534,"According to Honka Japan 's Managing Director Marko Saarelainen , Honkarakenne exports about 200 ready made log houses to Japan a year .",1,neutral
536,"According to Seikku , the retail sector in Finland is controlled by 3-4 large actors , while food manufacturers are still relatively small .",1,neutral
537,"Also , a six-year historic analysis is provided for these markets .",1,neutral
539,Amanda said that it had already made a USD5 .0 m investment commitment in Russia Partners II fund in July 2005 .,1,neutral
540,"An  of the invention , released by the Patent Office , said : `` The chambers are pressurized .",1,neutral
542,BasWare Order Matching automatically matches purchase invoices with approved purchase orders .,1,neutral
543,"Capacity of the facility made by Finland 's Vaahto Group is 86,000 tons of light coated paper .",1,neutral
545,"CapMan has four investment areas ( CapMan Buyout , CapMan Technology , CapMan Life Science and CapMan Real Estate ) , and each of them has a dedicated team .",1,neutral
546,Castecka said the town hall would hold talks with other investors interested in the zone .,1,neutral
547,"Changes being announced today will be effective after the close of trading on Friday , June 19 , 2009 .",1,neutral
548,"CHS Expo Freight is a major Finnish fair , exhibition and culture logistics company that provides logistics services to various events by land , air and sea .",1,neutral
550,"Complete name of shareholder : Otto Henrik Bernhard Nyberg For further information , please contact Maija-Liisa Friman , CEO , tel. +358 9 7597 0711 .",1,neutral
552,Construction is expected to be completed in the summer of 2011 .,1,neutral
553,Dragonfly Love is another video shot from start to finish using the Nokia N8 .,1,neutral
554,"Elcoteq 's Electronics Manufacturing Services ( EMS ) Business Segment serves customers globally in Engineering , Manufacturing and Fulfillment services .",1,neutral
555,"EQT has completed its exit from Salcomp , a Finnish company that makes mobile phone chargers , by selling its remaining stake to Swedish investment group Nordstjernan for about ( EURO ) 35 million ( $ 47 million ) .",1,neutral
556,"FinancialWire ( tm ) , in cooperation with the Investrend Broadcast Syndicate , also provides complete , daily conference call and webcast schedules as a service to shareholders and investors via the FirstAlert ( tm ) Networks oeFirstAlert ( tm ) Daily .",1,neutral
557,"Following the registration , the number of issued and outstanding shares of Basware is 12,890,829 .",1,neutral
558,Fortum had previously bought the state-held stake in TGK-10 from RAO UES during its reform .,1,neutral
559,"Goodwill and other intangible assets account for some 2.0 mln euro ( $ 2.6 mln ) of the purchase price , 20 pct of which payable in Aspo shares .",1,neutral
560,"Harold W. Young is an independent broker working closely with several retailers including Ahold USA , Market Basket , CVS , BJ 's Wholesale Club , Hannaford and Cumberland Farms .",1,neutral
561,"Honkarakenne mainly exports large luxury log houses to Russia to be used as one-family houses or holiday homes ; 70 % of sales go to the Moscow region , about 20 % to the St Petersburg region , and the remainder to other locations .",1,neutral
563,"In today s business , you have to pre-empt what consumers want , said Mohammed Zainalabedin , General Manager , Zain Bahrain .",1,neutral
564,Insurance policies should be simple .,1,neutral
565,"It is a member of the OneWorld alliance , which includes American Airlines and British Airways .",1,neutral
567,It will provide heating in the form of hot water for the sawmill 's needs .,1,neutral
568,Its 168 asset management experts manage assets worth over EUR 35 billion .,1,neutral
571,"Jun. 25 , 2008 ( Boy Genius Report delivered by Newstex ) -- The Nokia ( NYSE : NOK ) N78 , huh ?",1,neutral
572,"Last July , the group said it intended to relocate warehouse and office space in Loudeac and Saint Marcel to Morvillars , in the east of France , where it already operates a hook manufacturing and distribution unit .",1,neutral
575,"Name of Applicant : Jot Automation OYName of Inventor : Mammila Tuomo , Piirainen Mika and Kellokoski MikaApplication No. : 2424-KOLNP-2008 ADate of filing of Application : 16-06-2008Publication Date : 30/01/2009",1,neutral
576,National sponsors for The Big Read include National Endowment for the Arts in cooperation with the Institute of Museum and Library Services and Arts Midwest .,1,neutral
577,Neste Oil Corporation Refining Operation Asset Summary Report Summary Neste Oil Corporation Refining Operation Assets Summary Report is an essential source for company data and information .,1,neutral
581,"Panostaja , headquartered in Tampere , Finland , is an investment company focusing on small and medium-sized Finnish companies operating in the traditional industries .",1,neutral
585,"Prothious Engineering ( www.prothious.com ) employs more than 1,000 and has a large portfolio of projects and an annual detailing capacity of more than 100,000 tonnes .",1,neutral
586,Rapala aims to move the distribution unit Ragot from Loudeac in Bretagne and the distribution unit Waterqueen and the fishing line supplier Tortue from Saint Marcel in Central France to Morvillars .,1,neutral
587,"RAPALA TOURNAMENT FISHING : With all the major titles already out for the holidays , bargain-priced games such as Rapala aim for a smaller audience .",1,neutral
588,"RFID ( Radio Frequency Identification ) is a method of so-called intelligent transport , whereby information can be read and saved remotely .",1,neutral
589,"Sanoma also has an Executive Committee , in accordance with the Company 's Articles of Association , that prepares proposals for matters to be decided or noted by the Board of Directors .",1,neutral
590,"Sarantel , based in Wellingborough , UK , designs high-performance antennas for portable wireless devices .",1,neutral
592,"She will succeed Krister Kylas , who has decided to leave TeliaSonera .",1,neutral
595,Stock Exchange Release 10/3/2011 12:00 Sanoma has published its Annual Report and Financial Statements for 2010 and its first Corporate Responsibility Report .,1,neutral
596,"Stockholm-based Nordea Bank ( STO : NDA ) said yesterday it had hired Casper von Koskull to lead its corporate merchant banking and capital markets unit , effective 1 September .",1,neutral
598,Symphony Services provides development services for Aldata GOLD .,1,neutral
600,"Teleste 's hybrid TV solution includes components for the whole process of delivering video services to consumers from content acquisition and service creation to delivery through a range of access solutions , including HFC ( hybrid fibre-coaxial ) , xDSL , EttH , and FttH .",1,neutral
603,"The business has sales of about ( Euro ) 35 million ( $ 44million ) , and has been responsible for sales and marketing of Lanxess 's paper chemicals business , which Kemira bought for ( Euro ) 88 million early this year ( CW , Jan. 11 , p. 22 ) .",1,neutral
604,The business section also includes Ahlstrom 's sustainability report .,1,neutral
606,The company is presently examining whether the project would be financially feasible .,1,neutral
607,The company is studying the feasibility of focusing most of its processed meat production in the Vantaa facilities and the processing of fresh meat in the Forssa facilities .,1,neutral
608,The company specialises in temporary electrification and heating at construction sites .,1,neutral
610,The EUR 0.7 million non-recurring expenses have been recorded for the third quarter .,1,neutral
611,The event can be followed on-line via Orion 's Finnish homepage at www.orion.fi as well as via the Kauppalehti Live web service at www.kauppalehti.fi/live .,1,neutral
613,The first of the two project phases is expected to be completed by the end of 2012 .,1,neutral
614,"The group intends to relocate warehouse and office space in Loudeac and Saint Marcel to Morvillars , in the east of the country , where it already operates a hook manufacturing and distribution unit .",1,neutral
615,"The Group owns and operates a fleet of more than 800dwt , while container capacity is 17,000 TEUs , and manages a diversified fleet of its own railway rolling stock of over 17,000 units .",1,neutral
616,"The Hayward , Calif.-based target designs active , casual and dress footwear , as well as boots and sandals .",1,neutral
617,"The Lemminkainen Group , headquartered in Helsinki , Finland operates in all sectors of the construction industry : civil engineering , building contracting , technical building services and the building materials industry .",1,neutral
618,"The Marubeni Group focuses on creating `` value chain '' from upstream to downstream , encompassing a wide variety of business fields , including oil & gas , metals , mineral resources , foods , pulp & paper and chemicals , among others .",1,neutral
619,The new B shares carry the right to dividend and other shareholder rights with effect from today .,1,neutral
620,The office space will rise above the remodeled Cannon Street underground station .,1,neutral
621,The Oxyview Pulse Oximeter is a common device to check patient blood-oxygen saturation level and pulse rate .,1,neutral
622,The project is expected to be completed in 2009 .,1,neutral
623,"The reason for this is St. Petersburg status as a capital , one of the participants in the meeting quoted Chikunov as saying .",1,neutral
624,"The report goes on to provide detailed profiles of ten leading European specialty chemicals companies , and brief profiles of other major players .",1,neutral
625,"The report profiles 614 companies including many key and niche players worldwide such as Black & Decker Corporation , Fiskars Corporation , Fiskars Brands , Inc. , Husqvarna Outdoor Products Inc. , K+S Group , Ryobi Technologies , Inc. , The Scotts Miracle-Gro Company , and Van Group , Inc. .",1,neutral
628,The share of the share capital of both above mentioned shareholders remains below 5 % .,1,neutral
630,"The subsidiary will be responsible for filter sales , local assembly of filters and after market services in China .",1,neutral
632,The trade is in accordance with the agreement announced on 26 March 2008 .,1,neutral
633,The transaction is expected to be completed next spring .,1,neutral
634,The writing and publication of Lemmink+ñinen -¦ s history is a continuation of earlier collaboration between Antti Tuuri and the company .,1,neutral
635,"These products include Personal Communications products such as mobile phones and their parts , Home Communications products such as set-top boxes and electronics for flat panel TVs as well as Communications Networks products such as base-stations , tower-top amplifiers , and microwave systems .",1,neutral
638,"Utah 's capital wanted to be the next U.S. headquarters of Amer Sports Corp. , a ski-equipment company .",1,neutral
644,`` Our Vaalipalvelu-service was especially developed for use by communities and organizations .,1,neutral
646,18:30 Dinner The conference program can also be viewed as a live audio webcast through the internet pages at www.citycon.com .,1,neutral
647,A PLUMBING business has announced it is sponsoring a professional darts player .,1,neutral
648,"A. Le Coq Special was developed for the bicentenary of the company and the trade mark , the brewer said .",1,neutral
650,Aspo has also investigated the sales opportunities of Kaukomarkkinat 's electronics business .,1,neutral
651,"At the beginning of the subscription period on May 2 , 2006 the share subscription price under B option right is EUR 10.22 per share .",1,neutral
652,Both Mr Walden and Mr Ignatius will be responsible also for the newspapers ' business result .,1,neutral
653,Capitex Kalmar will continue to be responsible for the maintenance and technical development of the services .,1,neutral
655,Customers in a wide range of industries use our stainless steel and services worldwide .,1,neutral
659,"F-Secure , a developer of security solutions as a service through Internet Service Providers and mobile operators , announced results from its annual Online Wellbeing Survey .",1,neutral
660,"In 2008 , Kemira recorded revenue of approximately EUR 2.8 billion and had a staff of 9,400 .",1,neutral
661,"In accordance with the terms and conditions of Alma Media 's 2006 option program , the share subscription price for the 2006A option rights was EUR 4.88 per share and the book countervalue EUR 0.60 per share .",1,neutral
662,"In Penttil+ñ 's vision , the most important reason for the transaction is Russia .",1,neutral
663,It also confirmed its earnings guidance for the whole 2009 issued in its report for the whole 2008 .,1,neutral
664,It is hand-painted resin with real 14-0 trebles and is 75cm long by 25cm deep from top to bottom of the middle hook .,1,neutral
665,"It is part of the development of the world-class magnetite deposit at Karara , which has the known potential for over 30 million metric tons of annual processing of magnetite over its estimated 30-year life .",1,neutral
666,"It operates under three distinct brands : United Supermarkets , Market Street and United Supermercado .",1,neutral
667,Kaupthing Bank will publish its annual results for 2007 before markets open on Thursday 31 January .,1,neutral
669,The fine print is here .,1,neutral
670,M. and a Master of Business Administration MBA .,1,neutral
672,Ms Laakso will be responsible for HKScan 's HR functions and for their development in all of the Group ` smarket areas .,1,neutral
674,"Nokia Siemens Networks provides mobile and fixed network infrastructure , communications and networks service platforms , as well as professional services , to operators and service providers .",1,neutral
675,"Of these shares 29,659,239 are held by the Company or its group companies and the number of outstanding shares and voting rights attached to the shares thus amounts to 322,705,218 .",1,neutral
677,"Outotec 's scope of delivery includes design , basic engineering and supply of proprietary equipment for a sinter plant with a grate area of 496 square meters .",1,neutral
678,"Participants at any of the book discussions or other special events , or visitors to the car dealership were eligible to enter the drawing for the 2005 silver , four-door Altima .",1,neutral
682,"S Group 's loyal customer magazine Yhteishyv+ñ came second with 1,629,000 readers and Sanoma Corporation 's daily newspaper Helsingin Sanomat was third with 1,097,000 readers .",1,neutral
683,"SCOPI Chief Business Excellence Officer , Eng .",1,neutral
684,Subject-matter of the invention furthermore is the use of the cyclone for separating partly molten particles . '',1,neutral
685,"Taking a cue from the playbook of the East Dillon Lions , we 've created a special team of heavy-hitting style players , such as boot-cut jeans , tummy tops and , of course , cowboy boots .",1,neutral
686,"Tekla 's defense business employs over 20 persons and is located in Espoo , Finland .",1,neutral
687,"Tekla will organize an information meeting for analysts and media at WTC Helsinki Marski meeting room , Aleksanterinkatu 17 , the same day at 12:30 - 1:30 p.m. Light lunch will be served .",1,neutral
688,"The Annual General Meeting approved that the yearly remuneration for the members of the Board of Directors shall remain at EUR 40.000 for the Chairman of the Board , EUR 30.000 for the Deputy Chairman of the Board and EUR 20.000 for other members of the Board .",1,neutral
690,"The change in holdings in accordance with Chapter 2 , Section 9 of the Finnish Securities Markets Act is described below .",1,neutral
692,"The company designs , manufactures and markets advanced composite products for industrial applications and consumer goods such as cross-country , alpine and Nordic Walking poles , floorball sticks and antenna radomes .",1,neutral
693,"The company is owned by the State of Finland and the European Aeronautic Defense and Space Company EADS N.V. Tekla is an international software company that provides solutions for building and construction , energy distribution and municipalities .",1,neutral
695,"The contractor of the shopping center , China State Construction Engineering Corporation , has previously built e.g. airports , hotels and factories for large international customers in different parts of the world .",1,neutral
696,The corrected chapter is in its entirety below .,1,neutral
697,The deal was worth about EUR 1.2 mn .,1,neutral
698,The event can also be viewed as a live webcast at www.cargotec.com .,1,neutral
699,The investment will be worth approximately EUR 100mn .,1,neutral
700,The mill is concentrating on getting the supercalendered line running satisfactorily before restarting its older newsprint line .,1,neutral
701,The number of customers is one of the most important parameters in determining the price of electricity networks .,1,neutral
702,The order was valued at over EUR15m .,1,neutral
703,The order was valued at USD12 .2 m.,1,neutral
704,The order was worth EUR 8mn .,1,neutral
705,"The prerequisite for inclusion in the program and for receipt of any gains is that key employees acquire Aspo shares to the amount determined by the Board in advance , in the maximum .",1,neutral
706,"The record date for dividend distribution is March 14 , 2008 .",1,neutral
707,"The Samsung Mobile Applications Store was launched in January 2009 by Samsung Mobile Innovator , a program which enables mobile software developers to create applications for use across Samsung mobile devices .",1,neutral
709,"The study evaluated the safety , tolerability and pharmacokinetics of repeated doses of intravenously administered antibody in 26 patients with active plaque psoriasis .",1,neutral
712,The total project duration is three years and it is valued at some EUR11 .5 m.,1,neutral
713,"The total scope of the project is about 38,000 square metres and it is valued at a total of around EUR75m .",1,neutral
714,"They are responsible for their own operations , customer relationships , and the development of these .",1,neutral
715,"This implementation is very important to the operator , since it is about to launch its Fixed-to-Mobile convergence service in Brazil see Brazil : 8 May 2006 : .",1,neutral
716,This organization will assume the responsibility for operations in Russia .,1,neutral
717,"Thus the group 's balance sheet will have about EUR 25.8 million of goodwill , the company added .",1,neutral
718,"Thus the group 's balance sheet will have about EUR25 .8 m in goodwill for 2010 , the company added .",1,neutral
719,Timo Penttila has been appointed new manager responsible for the asset management of Nordea 's institutional customers in Finland .,1,neutral
720,"To see more of New Haven Register , or to subscribe to the newspaper .",1,neutral
721,"Trading in the new shares , which have right to dividends and other distributions of funds , will start on the exchange in Helsinki tomorrow .",1,neutral
723,"Vehvilainen , who is currently the chief operating officer at Nokia Siemens Networks , will join Finnair on 5 January 2010 and take over as CEO effective 1 February 2010 .",1,neutral
724,"Yara Suomi Ltd also provides nitrogen chemicals and technical nitrates to various sectors of industry , as well as products used in environmental protection .",1,neutral
725,"Net sales of Finnish Sanoma Learning & Literature , of Finnish media group Sanoma , decreased by 3.6 % in January-June 2009 totalling EUR 162.8 mn , down from EUR 168.8 mn in the corresponding period in 2008 .",0,negative
726,"JP Morgan expects that Scala will lower Nobel Biocare 's growth forecast for 2007 from the current guidance of 23-25 pct , as well as the operating margin target from the current 34-35 pct .",0,negative
728,"Profitability ( EBIT % ) was 13.6 % , compared to 14.3 % in Q2 2009 .",0,negative
729,Sales of mid-strength beer decreased by 40 % .,0,negative
731,The company will make its marketing and sales investments initiated in 2009 even more efficient in 2010 .,2,positive
732,"The stock is trading above both its MAPs and the 50-day MAP of SEK72 .983 is higher than the 200-day MAP of SEK70 .283 , a bullish indicator .",2,positive
735,"( ADP News ) - Finnish handling systems provider Cargotec Oyj ( HEL : CGCBV ) announced on Friday it won orders worth EUR 10 million ( USD 13.2 m ) to deliver linkspans to Jordan , Morocco and Ireland .",2,positive
736,Merrill Lynch analyst Campbell Morgan upgraded his recommendation on PaperlinX from `` neutral '' to `` buy '' in May .,2,positive
739,Raute said it has won an order worth around 15 mln eur to supply several plywood production lines to mills operated by Russian wood products company Sveza Group .,2,positive
740,"The brokerage said 2006 has seen a ` true turning point ' in European steel base prices , with better pricing seen carrying through the second quarter of 2006 .",2,positive
741,"This location makes the mall a convenient place to shop for consumers from three large residential areas nearby : Jaroszowka , Wysockiego and Zgody .",2,positive
742,"`` Lining stone sales were also good in the early autumn , and order books are strong to the end of the year .",2,positive
743,"`` This vessel order will help Aspo secure the long-term competitiveness of its fleet , both in terms of technology and pricing .",2,positive
746,"Vaahto Pulp & Paper , of Finnish Vaahto Group , has been awarded an order to renovate Finnish-Swedish forest industry company Stora Enso 's paperboard machine at the Ingerois Board Mill in Finland .",2,positive
747,"Combining the two producers will create a strong EU-based fertilizer industry capable of meeting global competition , they added .",2,positive
750,"London 's leading shares today jumped almost 100 points , or 1.7 % , as the market opened .",2,positive
751,"Mika Stahlberg , VP F-Secure Labs , said , `` We are excited and proud that F-Secure has been recognized by AV-Comparatives as the Product of the Year .",2,positive
752,The policy was also aimed at making the companies more profitable and competitive .,2,positive
753,"Finland 's leading metals group Outokumpu said its fourth-quarter net profit more than tripled on the back of strong global demand for stainless steel , soaring base metal prices and proceeds from the sale of its technology unit .",2,positive
754,"The company has the poser , who wants to impress people with the latest handset .",1,neutral
755,According to an  posted by the World Intellectual Property Organization : `` The present invention relates to hydrocarbons and particularly to the manufacture of hydrocarbon components suitable as aviation fuels or jet fuels and as blending stocks for aviation fuels .,1,neutral
756,And that 's exactly what happened on a recent weekday when an East Haven baker was brought in to remind residents about the Easter tradition of making wheat and rice pies .,1,neutral
757,Any investment or investment activity to which this communication relates is only available to relevant persons and will be engaged in only with relevant persons .,1,neutral
758,"Fortum needs a clear signal of commitment from the Government that the permit is available before the company will start the next round , Kuula says .",1,neutral
